{"bindings":{"c342_relocation_ledger":{"count":66,"immutable":true,"path":"data/vv5_origins_feature.json","rows_sha256":"14E460773ADC065E053FA30921ED01D33A5F36AD49DC754CCD69127EA02C01B7","source_text_algorithm":"vvfp.source-text.v1","source_text_sha256":"6AFF1A8E69234C61CB2D1878C46FA91B0AAA721FC5F29C5B42A678F61BAB8528"},"central_index_gate":{"candidate_edit_count":15,"overlap_count":0,"path":"data/expanded_256_stored_index_evidence.json","source_text_sha256":"02C0957E2A6ED5F702955821F68CE7A8A751C4C807FE5C34665DCA6FF00E786A","status":"partial_static_stop"},"expanded_manifest":{"game":"vv5","immutable":true,"path":"data/expanded_256.json","row_count":1951,"rows_sha256":"D0E899B112C106AF136D6D2F91C68C97CF6B431DB6F5457CBD6211852BA01431"},"prototype_checksum":"98F10F00","prototype_sha256":"1C825CB6AC3C7E1368D3EFD9C81E844A336AB31C7EBA0971674601F25E3E8F0B","prototype_size":991232,"save_geometry":{"overlap_count":0,"path":"data/expanded_256_save_serializer_abi_evidence.json","source_text_sha256":"6C5BFF59650D33CCE8B28153DE125A3AA2E9B7CB776179F2A753E691E0B670A0","status":"unknown_stop"},"stock_sha256":"92946781980220E9D1A2E6C573925519934608F5215F4A0F8CE3B90088C5C65D"},"canonical_sha256":"ADC01E784032F598FF23790BBCDB622C2C33F4EAEF57D6865D8BFE6DAC273237","catalog_visible":false,"enabled":false,"evidence":{"blockers":["complete-folder authenticated runtime capture","late-record and save/reload player receipts","publication review"],"player_receipts":[],"runtime_receipts":[],"static_preimages_reviewed":true,"static_result_reviewed":true},"native_output":false,"overlay":{"checksum_after":"6E3B0F00","checksum_before":"98F10F00","checksum_raw":"0x150","dbxxx_range":{"end_exclusive":"0xDC000","overlap_count":0,"start":"0xDB000"},"kind":"guarded_same_width_post_prototype","relocation_ledger_overlap_count":0,"result_sha256":"AF537A02F0E1983F22966923E736A4595B53EDC625D4C2F20414AB55FD54BBDC","result_size":991232,"row_count":16,"rows":[{"after":"50482F00","before":"A8462F00","category":"manager_tail","id":"manager_tail_0","reviewed_locator_raw":"0x6F830","width":4,"write_raw":"0x6F830"},{"after":"50482F00","before":"A8462F00","category":"manager_tail","id":"manager_tail_1","reviewed_locator_raw":"0x71D3E","width":4,"write_raw":"0x71D3E"},{"after":"50482F00","before":"A8462F00","category":"manager_tail","id":"manager_tail_2","reviewed_locator_raw":"0x71D68","width":4,"write_raw":"0x71D68"},{"after":"50482F00","before":"A8462F00","category":"manager_tail","id":"manager_tail_3","reviewed_locator_raw":"0x71D80","width":4,"write_raw":"0x71D80"},{"after":"50482F00","before":"A8462F00","category":"manager_tail","id":"manager_tail_4","reviewed_locator_raw":"0x71DCF","width":4,"write_raw":"0x71DCF"},{"after":"50492F00","before":"40472F00","category":"manager_pool","id":"manager_pool_0","reviewed_locator_raw":"0x6F84C","width":4,"write_raw":"0x6F84C"},{"after":"50492F00","before":"40472F00","category":"manager_pool","id":"manager_pool_1","reviewed_locator_raw":"0x71DE6","width":4,"write_raw":"0x71DE6"},{"after":"50492F00","before":"40472F00","category":"manager_pool","id":"manager_pool_2","reviewed_locator_raw":"0x72188","width":4,"write_raw":"0x72188"},{"after":"480A3000","before":"38083000","category":"tail_offset","id":"tail_offset_0","reviewed_locator_raw":"0x888CF","width":4,"write_raw":"0x888CF"},{"after":"380A3000","before":"28083000","category":"tail_offset","id":"tail_offset_1","reviewed_locator_raw":"0x88E3F","width":4,"write_raw":"0x88E3F"},{"after":"38943300","before":"28923300","category":"tail_offset","id":"tail_offset_2","reviewed_locator_raw":"0x8ACA3","width":4,"write_raw":"0x8ACA3"},{"after":"38943300","before":"28923300","category":"tail_offset","id":"tail_offset_3","reviewed_locator_raw":"0x8B34D","width":4,"write_raw":"0x8B34D"},{"after":"81EC28080000","before":"81ECD8040000","category":"candidate_array","id":"candidate_frame","reviewed_locator_raw":"0x71EB8","width":6,"write_raw":"0x71EB6"},{"after":"6800040000","before":"6858020000","category":"candidate_array","id":"candidate_capacity","reviewed_locator_raw":"0x71EC3","width":5,"write_raw":"0x71EC2"},{"after":"899C8438040000","before":"899C8490020000","category":"candidate_array","id":"candidate_store","reviewed_locator_raw":"0x7203C","width":7,"write_raw":"0x72039"},{"after":"8B84B438040000","before":"8B84B490020000","category":"candidate_array","id":"candidate_load","reviewed_locator_raw":"0x720B3","width":7,"write_raw":"0x720B0"}],"size_change":0},"player_go":false,"publication_ready":false,"runtime_go":false,"schema":"vvfp.vv5_post_prototype_overlay.v1","status":"static_overlay_go_runtime_stop"}
